seq,page_num,content,chapter_title,all_sections,count_words,count_sent,state,is_table,book_title,book_path
68,73,"ATLANTIC CITY ELECTRIC COMPANY 
BPU NJ No. 11 Electric Service - Section IV  First Revised Sheet Replaces Original Sheet No. 63a 
RIDER ANEM 
Aggregated Net Energy Metering 
 
AVAILABILITY 
This Rider is available to any customer served under the Company’s Rate Schedules RS, MGS-Secondary, MGS-
SEVC, MGS-Primary, AGS Secondary, AGS Primary, TGS Sub-Transmission, and TGS Transmission who owns and 
operates a customer-generator facility that: 
 
1)  Is a solar electric power generation system; and 
2)  Is not an on-site generation system; and 
3)  Is located on the customer’s premises; and 
4)  Is interconnected and operated in parallel with the Company’s transmission or distribution facilities; and 
5)  Is intended primarily to offset all or part of the customer’s own aggregated electricity requirements; and 
6)  Is not a Qualifying Facility (QF) served under the Company’s Rate Schedule SPP, Small Power Purchase; and 
7)  The customer Is a State entity, school district, county, county agency, county authority, municipality, municipal 
agency, or municipal authority; and have multiple metered accounts including the host account that: 
a)  Must be located within the customer's territorial jurisdiction or, for a State entity, be located within 5 miles of 
one another; and 
b)  Are served by Basic Generation Service (BGS) under the same eligible rate schedule or be supplied by the 
same (third-party) energy supplier; and 
c)  None of the accounts to be aggregated have been included in a previous aggregation for another qualified 
customer facility; and 
d)  is not located on land that has been actively devoted to agricultural or horticultural use and that is valued, 
assessed, and taxed pursuant to the Farmland Assessment Act of 1964 at any time within the 10 years 
prior to July 23, 2012.  (The municipal planning board of a municipality where the customer-generator 
facility is to be located may waive this requirement.) 
The customer may aggregate the meters for the purpose of net metering regardless of which individual meter 
receives energy from a customer-generator facility provided that:  
1) Before a customer can participate under this rider and activate the customer-generator facility, the customer 
shall file an application with the Company available at: 
http://www.atlanticcityelectric.com/greenpowerconnection/ and include the following information:  
a)  For the metered account behind which a customer-generator is net metered (“the host account”), a 
description of the customer-generator facility including its location, capacity, and description of its 
generating technology;  
b)  A list of the individual metered accounts that the customer seeks to aggregate, identified by name, 
address, rate schedule, and account number;   
 
2) The customer may provide written notice of a change to its list of aggregated metered accounts no more than 
once annually and should allow for up to 30 days for the change to go into effect; and  
3) In order to continue under this rider, the customer must notify the Company of any change in ownership of 
the accounts by providing the Company 30 days written notice. 
 
Customer-generators applying under this rider may be subject to FERC jurisdiction with respect to net sales of 
excess generation and interconnection requirements. 
eligible customer participating aggregated net metering under this Rider can be charged by the Company for 
incremental costs providing this service. 
 
 
Date of Issue: February 26, 2021    Effective Date: March 1, 2021 
 
Issued by:  David M. Velazquez, President and Chief Executive Officer – Atlantic City Electric Company  
Filed pursuant to Board of Public Utilities of the State of New Jersey directives associated with the  
BPU Docket No. EO18020190   ",et Energy Metering    AVAILABILITY  http,[],750,12,new jersey,False,ACE atlantic city electric company tariff for electric service,docs/raw/dump/new_jersey/NJ ACE - Rate Schedule 11.2022.pdf
69,74,"ATLANTIC CITY ELECTRIC COMPANY  
BPU NJ No. 11 Electric Service - Section IV  Original Sheet No. 63b 
 
RIDER ANEM (Continued) 
Aggregated Net Energy Metering 
 
CONNECTION TO THE COMPANY’S SYSTEM 
Any customer who elects this Rider must submit a New Jersey Interconnection Application Form with the Company, 
at least 30 days prior to activating the customer-generator facility.  The customer should not install a customer-
generator facility without prior approval from the Company and the customer shall not operate a customer-generator 
facility without final written approval from the Company.   
 
The customer-generator facility shall not be connected to the Company’s system unless it meets all applicable 
safety and performance standards established by the National Electric Code, The Institute of Electrical and 
Electronics Engineers (IEEE), Underwriters Laboratories, and as currently detailed in the Technical Considerations 
Covering Parallel Operations of Customer Owned Generation and Interconnected with the Company’s Power 
Delivery System in the State of New Jersey and the applicable codes of the local public authorities.  Special 
attention should be given to IEEE Standard 929-2000 Recommended Practice for Utility Interface of Photovoltaic 
Systems.  The customer must obtain, at the customer’s sole expense, all necessary inspections and approvals 
required by the local public authorities before the customer-generator facility is connected to the Company’s electric 
system. 
 
INTERCONNECTION AND PARALLEL OPERATION 
Interconnection with the Company’s system requires the installation of protective equipment which provides 
safety for personnel, affords adequate protection against damage to the Company’s system or to the 
Customer’s property, and prevents any interference with the Company’s supply of service to other 
customers. Such protective equipment shall be installed, owned and maintained by the customer at the 
customer’s sole expense. Generation systems and equipment that comply with the standards established in 
the previous Section of this Rider shall be deemed by the Company to have generally complied with the 
requirements of this Section. 
 
CESSATION OF PARALLEL OPERATION 
The customer’s equipment must be installed and configured so that parallel operation must cease 
immediately and automatically during system outages or loss of the Company’s primary electric source.  
The customer must also cease parallel operation upon notification by the Company of a system emergency, 
abnormal condition, or in cases where such operation is determined to be unsafe, interferes with the supply 
of service to other customers, or interferes with the Company’s system maintenance or operation.   
 
DELIVERY VOLTAGE 
The delivery voltage of the customer-generator facility shall be at the same voltage level and at the same delivery 
point as if the customer were purchasing all of its electricity from the Company. 
 
TERM OF CONTRACT 
The contract term shall be same as that under the customer’s applicable Rate Schedule.  
 
MONTHLY RATES, RATE COMPONENTS AND BILLING UNIT PROVISIONS 
The monthly rates, rate components and billing unit provisions shall be those as stated under the customer’s 
applicable Rate Schedule.  Under this Rider, only the per kilowatt-hour charge components of the customer’s bill for 
the host account are affected.  The monthly charges shall be based on one of the following conditions:  
a)  When the monthly energy meter reading registers on the host account that the customer has consumed more 
energy than the customer delivered to the Company’s delivery system by the end of the monthly billing period, 
the customer shall be charged for the net amount of electricity consumed based on the rates and charges under 
the customer’s applicable Rate Schedule for either Delivery Service when the customer has a third party 
supplier  as its electric supplier, or the combined Delivery, Transmission and Basic Generation Service when 
the customer has the Company as its electric supplier; or  
 
Date of Issue:  March 27, 2019    Effective Date: April 1, 2019 
Issued by:  David M. Velazquez, President and Chief Executive Officer – Atlantic City Electric Company  
Filed pursuant to Board of Public Utilities of the State of New Jersey directives associated with the  
BPU Docket No. ER18080925   ",ring  CONNECTION TO THE COMPANY’S SYSTEM,[],782,22,new jersey,False,ACE atlantic city electric company tariff for electric service,docs/raw/dump/new_jersey/NJ ACE - Rate Schedule 11.2022.pdf
70,75,"ATLANTIC CITY ELECTRIC COMPANY  
BPU NJ No. 11 Electric Service - Section IV  Original No. 63c 
 
RIDER ANEM (Continued) 
Aggregated Net Energy Metering 
 
b)  If the customer is receiving combined Delivery, Transmission and Basic Generation Service, and the monthly 
energy meter reading on the host account registers that the customer has delivered more energy to the 
Company’s delivery system than the customer has consumed by the end of the monthly billing period, the 
customer shall be charged the Customer Charge and any appropriate demand charges based on the customer’s 
applicable Rate Schedule.  In addition, the Company shall receive and take ownership of the delivered energy 
from the customer and the Company shall credit the customer for that delivered energy on the next monthly billing 
period.  At the end of twelve consecutive monthly billing periods beginning with the first month in which net 
metering becomes applicable (annualized period), the customer will be compensated for any remaining credits 
at the average locational marginal price for energy, for the annualized period, in the Pennsylvania, New Jersey 
and Maryland Interconnection (PJM) Control Area Transmission Zone for the Company.  In the event that a 
customer leaves Basic Generation Service prior to the end of the annualized period, the end of the service period 
will be treated as if it were the end of the annualized period; or 
 
c)  If the customer has a third party supplier and the monthly energy meter reading on the host account registers that 
the customer has delivered more energy to the Company’s delivery system than the customer has consumed by 
the end of the monthly billing period, the customer shall be charged the Customer Charge and any appropriate 
demand charges based on the customer’s applicable Rate Schedule. Monthly meter data will be forwarded to the 
customer’s third party supplier in accordance with existing Electronic Data Interchange (EDI) Standards.  In the 
event that a customer changes electric supplier prior to the end of the annualized period, the end of the service 
period will be treated as if it were the end of the annualized period. 
 
The customer has one opportunity to select an annualized billing period in accordance with the provisions of N.J.A.C. 
14:8-4.3. 
 
RENEWABLE ENERGY CREDITS 
The Renewable Energy Credits generated by the customer-generator facility are owned entirely by the customer or 
the eligible customer’s assignee.   
 
METERING 
The watt-hour energy meter at the customer’s location shall measure the net energy consumed by the customer or 
the net energy delivered by the customer-generator facility for the monthly billing period.  The Company shall 
furnish, install, maintain and own all the metering equipment needed for measurement of the service supplied. 
 
MODIFICATION OF THE COMPANY’S SYSTEM 
If it is necessary for the Company to extend or modify portions of its systems to accommodate the delivery of electricity 
from the customer-generator facility, the Company, at the customer’s sole expense, shall perform such extension or 
modification. 
 
LIABILITY 
The Company accepts no responsibility whatsoever for damage or injury to any person or property caused by failure 
of the customer to operate in compliance with Company’s requirements. The Company shall not be liable for any loss, 
cost, damage or expense to any party resulting from the use or presence of electric current or potential which 
originates from the customer-generator facility.  Connection by the Company under this Rider does not imply that the 
Company has inspected or certified that the customer-generator facility has complied with any necessary local codes 
or applicable safety or performance standards.  All inspections, certifications and compliance with applicable local 
codes and safety requirements are the sole responsibility of the customer-generator. 
 
Date of Issue:  March 27, 2019    Effective Date: April 1, 2019 
 
Issued by:  David M. Velazquez, President and Chief Executive Officer – Atlantic City Electric Company  
Filed pursuant to Board of Public Utilities of the State of New Jersey directives associated with the  
BPU Docket No. ER18080925    ",RENEWABLE ENERGY CREDITS  METERING,[],783,23,new jersey,False,ACE atlantic city electric company tariff for electric service,docs/raw/dump/new_jersey/NJ ACE - Rate Schedule 11.2022.pdf
71,76,"ATLANTIC CITY ELECTRIC COMPANY 
BPU NJ No. 11 Electric Service - Section IV  Original Sheet No. 63d 
RIDER ANEM (Continued) 
Aggregated Net Energy Metering 
 
 
FAILURE TO COMPLY 
If the customer fails to comply with any of the requirements set forth in this Rider, the Company may disconnect the 
customer’s service from the Company’s electric system until the requirements are met, or the customer-generator 
facility is disconnected from the customer’s electric system. 
 
TERMS AND CONDITIONS 
The Terms and Conditions set forth in this tariff shall govern the provision of service under this Rider. 
 
 
 
 
 
 
 
 
 
 
 
 
 
 
 
 
 
 
 
 
 
 
 
 
 
 
 
 
 
 
 
 
 
 
 
 
 
 
 
 
 
 
Date of Issue:  March 27, 2019    Effective Date: April 1, 2019 
 
Issued by:  David M. Velazquez, President and Chief Executive Officer – Atlantic City Electric Company  
Filed pursuant to Board of Public Utilities of the State of New Jersey directives associated with the  
BPU Docket No. ER18080925    ",g    FAILURE TO COMPLY  TERMS AND CONDIT,[],177,5,new jersey,False,ACE atlantic city electric company tariff for electric service,docs/raw/dump/new_jersey/NJ ACE - Rate Schedule 11.2022.pdf
72,77," 
ATLANTIC CITY ELECTRIC COMPANY 
BPU NJ No. 11 Electric Service - Section IV Twenty-Sixth Revised Sheet Replaces Twenty-Fifth Revised 
Sheet No. 64 
 
RIDER RGGI 
 
Regional Greenhouse Gas Initiative Recovery Charge 
 
A.  Applicability 
 
 
This Rider is applicable to Rate Schedules RS, MGS Secondary, MGS-SEVC, MGS Primary, AGS Secondary, AGS 
Primary, TGS, DDC, SPL and CSL.  Amounts billed to customers shall include a charge to reflect regional greenhouse 
gas initiative program costs.  Except where indicated otherwise, Rider “RGGI” will be determined annually based on 
projections of program costs (including an adjustment for variances between budgeted and actual prior year 
expenditures) and forecasts of kilowatt hour sales.  The charge (in dollars per kilowatt hour) will be computed by 
dividing the total annual amount to be recovered for by forecasted retail sales (in kilowatt hours).  
 
 
RGGI Programs 
 
 
Solar Renewable Energy Certificate (SREC) ($/kWh)            $0.000189 
This charge component is intended to recover net costs associated with the Solar Renewable Energy Certificate 
Program. 
 
Solar Renewable Energy Certificate (SREC II) ($/kWh)                        $0.000000 
This charge component is intended to recover net costs associated with the Solar Renewable Energy Certificate II 
Program. 
 
Transition Renewable Energy Certificate (TREC) ($/kWh)                                                      $0.000988 
This charge component is intended to recover net costs associated with the Solar Transition Incentive Program.  
 
Energy Efficiency Surcharge (EE) ($/kWh)                                                                              $0.000840 
This charge component is intended to recover the costs associated with the Energy Efficiency Program. 
 
Successor Solar Incentive Program (SuSI) ($/kWh)  $0.000379     
This charge component is intended to recover the costs associated with the Successor Solar Incentive Program. 
 
Community Solar Energy Program (CSEP) ($/kWh)             $0.000000 
This charge component is intended to recover the net costs associated with the Community Solar Energy Program. 
 
 
 
Total Rider RGGI Surcharge ($/kWh)  $0.002396 
 
 
 
 
 
 
 
 
 
 
 
 
 
Date of Issue: August 26, 2022    Effective Date: September 1, 2022 
 
Issued by:  J. Tyler Anthony, President and Chief Executive Officer – Atlantic City Electric Company  
Filed pursuant to Board of Public Utilities of the State of New Jersey directives associated with the  
BPU Docket Nos. ER22020114 and ER21060871 
 ",ER RGGI    Regional Greenhouse Gas Initi,[],457,16,new jersey,False,ACE atlantic city electric company tariff for electric service,docs/raw/dump/new_jersey/NJ ACE - Rate Schedule 11.2022.pdf
73,78,"ATLANTIC CITY ELECTRIC COMPANY 
BPU NJ No. 11 Electric Service - Section IV        Fourth Revised Sheet Replaces Third Revised Sheet No. 65 
 
 
 
 
 
 
 
 
 
 
 
 
 
 
Intentionally Left Blank 
 
 
 
 
 
 
 
 
 
 
 
 
 
 
 
 
 
 
 
 
 
 
 
 
 
 
 
 
 
 
 
 
 
 
 
 
 
 
 
Date of Issue:  March 27, 2019    Effective Date: April 1, 2019 
 
Issued by:  David M. Velazquez, President and Chief Executive Officer – Atlantic City Electric Company  
Filed pursuant to Board of Public Utilities of the State of New Jersey directives associated with the  
BPU Docket No. ER18080925    ",Intentionally Left Blank,[],92,4,new jersey,False,ACE atlantic city electric company tariff for electric service,docs/raw/dump/new_jersey/NJ ACE - Rate Schedule 11.2022.pdf
74,79," 
ATLANTIC CITY ELECTRIC COMPANY               
BPU NJ No. 11 Electric Service - Section IV Third Revised Tariff Sheet Replaces Second Revised Tariff 
Sheet No. 66  
 
RIDER EDIT 
 
Excess Deferred Income Tax Credit 
 
 
 
AVAILABILITY 
This rider is applicable to Rate Schedules RS, MGS Secondary, MGS Primary, AGS Secondary, AGS Primary, TGS, 
DDC, SPL and CSL.   
 
Rider “EDIT” is to ensure the full amount of the Tax Cut and Jobs Act (TCJA) tax benefits associated with the non-
protected assets are returned to customers over a five (5) year period.  
 
The charge for each Rate Schedule is as follows: 
 
 
Rate Class    EDIT Credit (w/ SUT)   
RS     $                 (0.004884)  $ per kWh 
MGS Secondary     $                 (0.004789)  $ per kWh 
MGS Primary     $                 (0.000000)  $ per kWh 
AGS Secondary     $                 (0.002785)  $ per kWh  
AGS Primary     $                 (0.001621)  $ per kWh  
TGS Subtransmission     $                 (0.000605)  $ per kWh  
TGS Transmission     $                 (0.000630)  $ per kWh  
SPL/CSL     $                 (0.019798)  $ per kWh 
DDC     $                 (0.003515)  $ per kWh 
 
 
 
 
 
 
 
 
 
 
 
 
 
 
 
 
 
 
Date of Issue:  July 1, 2022    Effective Date: September 1, 2022 
 
Issued by:  J. Tyler Anthony, President and Chief Executive Officer – Atlantic City Electric Company  
Filed pursuant to Board of Public Utilities of the State of New Jersey directives associated with the  
BPU Docket No. ER20120746 
   ",et No. 66     RIDER EDIT    Excess Defer,[],313,8,new jersey,False,ACE atlantic city electric company tariff for electric service,docs/raw/dump/new_jersey/NJ ACE - Rate Schedule 11.2022.pdf
75,80,"ATLANTIC CITY ELECTRIC COMPANY 
BPU NJ No. 11 Electric Service - Section IV        Second Revised Sheet Replaces First Revised Sheet No. 67 
 
ZERO EMISSION CERTIFICATE (“ZEC”)  
RECOVERY CHARGE 
 
APPLICABILITY: The Zero Emission Certificate Recovery Charge (“Rider ZEC” or “ZEC Charge”) provides a 
charge for the recovery of costs associated with the Zero Emission Certificate Program directed by the Board of 
Public Utilities (“BPU” or “Board”) as detailed below.  The ZEC Charge is applicable to all kWh usage of any Full 
Service Customer or Delivery Service Customer. 
 
Rate Component ($ per kWh) 
 
  Excluding SUT  Including SUT 
ZEC Charge  $0.004000  $0.004265 
ZEC Reconciliation Charge  $(0.000078)  $(0.000083) 
Total ZEC Charge  $0.003922  $0.004182 
 
 
Pursuant to the BPU’s Zero Emission Certificate Charge Order dated November 19, 2018 in BPU Docket No. 
EO18091003, the Board approved the implementation of a non-bypassable, irrevocable ZEC Charge of $0.004000 
per kWh for all customers.  The ZEC Charge reflects the emission avoidance benefits of the continued operation of 
selected nuclear plants as determined in L. 2018, c. 16 (the “ZEC Law”).  The ZEC Charge has been set at the rate 
specified in the ZEC Law and may be adjusted periodically by the Board, in accordance with the methodology 
provided for in the ZEC Law. 
 
In accordance with the ZEC Law, the proceeds of the ZEC Charge will be placed in a separate, interest-bearing 
account and will be used solely to purchase ZECs and to reimburse the Board for its reasonable, verifiable costs 
incurred to implement the ZEC program. Refunds will be provided to the customers served under each of the 
Company’s rate schedules in proportion to the ZEC Charge revenues contributed by the rate schedule.  
 
The ZEC Charge will become effective upon the issuance of the April 2019 Board Order in BPU Docket No. 
EO18080899.   
 
 
 
 
 
 
 
 
 
 
 
 
 
 
 
 
 
 
 
 
 
Date of Issue:  April 21, 2022  Effective Date:  May 1, 2022 
 
Issued by:  J. Tyler Anthony, President and Chief Executive Officer – Atlantic City Electric Company 
Filed pursuant to Board of Public Utilities of the State of New Jersey directives associated with the BPU 
Docket Nos. EO18080899 and EO21101179 
 
 
 ",CERTIFICATE (“ZEC”)   RECOVERY CHARGE,[],455,15,new jersey,False,ACE atlantic city electric company tariff for electric service,docs/raw/dump/new_jersey/NJ ACE - Rate Schedule 11.2022.pdf
76,81," 
ATLANTIC CITY ELECTRIC COMPANY 
BPU NJ No. 11 Electric Service - Section IV                      Second Revised Sheet Replaces First Revised 
Sheet No. 68 
RIDER IIP 
Infrastructure Investment Program  
 
APPLICABILITY: 
 
This rider is applicable to Rate Schedules RS, MGS Secondary, MGS Primary, AGS Secondary, AGS Primary, 
TGS, DDC, SPL and CSL, and Rider STB. 
 
This charge provides for the full and timely recovery of revenue requirements associated with the Infrastructure 
Investment Program (“IIP”) projects subject to the IIP recovery rules, codified at N.J.A.C. 14:3-2A.1 et seq., as 
approved by the New Jersey Board of Public Utilities.  
 
The following table provides the rates for the IIP, including (“SUT”). For billing presentation purposes these rates 
are to be added to the base distribution rates for each Rate Schedule. This applies to the distribution charges for 
the Rate Schedules on the following Tariff Sheets: 5, 11, 14, 17, 19, 29, 29a, 31, 36, 37,37a, 40, and 44. These 
rates are subject to all other applicable charges and taxes in accordance with the underlying rate schedule’s 
distribution rates.  
      
RATE      IIP   
SCHEDULE    Rate                Billing Units  
 
RS    $ 0.001282  Per kWh 
 
MGS Secondary    $ 0.04                     Per kW 
    $ 0.001095  Per kWh 
 
MGS Primary    $ 0.03   Per kW 
    $ 0.000758  Per kWh 
 
AGS Secondary    $ 0.24   Per kW 
 
AGS Primary    $ 0.17   Per kW 
 
TGS Sub Transmission  $ 0.06   Per kW 
 
TGS Transmission   $ 0.04   Per kW 
 
SPL/CSL    $ 0.27    Per lamp per month 
 
DDC 
Service and Demand (per day per connection)  $ 0.002775   
Energy (per day for each kW of effective load)  $ 0.013367   
 
RIDER STB         
MGS Secondary    $ 0.00   Per kW 
MGS Primary    $ 0.00   Per kW 
AGS Secondary    $ 0.02    Per kW 
AGS Primary    $ 0.02   Per kW 
TGS – Sub Transmission  $ 0.00   Per kW   
TGS – Transmission  $ 0.00   Per kW   
 
 
 
 
Date of Issue: March 31, 2022    Effective Date: April 1, 2022 
 
Issued by: J. Tyler Anthony, President and Chief Executive Officer – Atlantic City Electric Company  
Filed pursuant to Board of Public Utilities of the State of New Jersey directives associated with the  
BPU Docket No. ER21111206 
 
 ",68  RIDER IIP  Infrastructure Investment,[],481,13,new jersey,False,ACE atlantic city electric company tariff for electric service,docs/raw/dump/new_jersey/NJ ACE - Rate Schedule 11.2022.pdf
